"product_name","product_url","product_instock","product_price"
"Philips Hue White A19 60W Equivalent LED Smart Bulb Starter Kit (4 A19 White Bulbs and 1 Hub Compatible with Amazon Alexa Apple HomeKit and Google Assistant)","https://www.amazon.com/Philips-Hue-Equivalent-Compatible-Assistant/dp/B07354SP1C/ref=sxin_0_osp48-aa92a2dc_cov?ascsubtag=aa92a2dc-3c51-4bd4-84ae-194e86169596&creativeASIN=B07354SP1C&cv_ct_cx=smart+light&cv_ct_id=amzn1.osp.aa92a2dc-3c51-4bd4-84ae-194e86169596&cv_ct_pg=search&cv_ct_wn=osp-search&keywords=smart+light&linkCode=oas&pd_rd_i=B07354SP1C&pd_rd_r=d7ebff29-4c90-446b-976e-e851b5ad6a99&pd_rd_w=yQaj8&pd_rd_wg=xAElo&pf_rd_p=62c00474-6fe0-420f-9956-a05256e04b43&pf_rd_r=28SPZKBDXS36QTHWAWGK&qid=1581539632&sr=1-1-32a32192-7547-4d9b-b4f8-fe31bfe05040&tag=spyonsite-20","",""
"Smart WiFi Light Bulb, LED RGB Color Changing, Compatible with Alexa and Google Home Assistant, No Hub Required, A19 E26 Multicolor LUMIMAN 2 Pack","https://www.amazon.com/Changing-Compatible-Assistant-Multicolor-LUMIMAN/dp/B07DLSNNDS/ref=sxin_0_osp48-aa92a2dc_cov?ascsubtag=aa92a2dc-3c51-4bd4-84ae-194e86169596&creativeASIN=B07DLSNNDS&cv_ct_cx=smart+light&cv_ct_id=amzn1.osp.aa92a2dc-3c51-4bd4-84ae-194e86169596&cv_ct_pg=search&cv_ct_wn=osp-search&keywords=smart+light&linkCode=oas&pd_rd_i=B07DLSNNDS&pd_rd_r=d7ebff29-4c90-446b-976e-e851b5ad6a99&pd_rd_w=yQaj8&pd_rd_wg=xAElo&pf_rd_p=62c00474-6fe0-420f-9956-a05256e04b43&pf_rd_r=28SPZKBDXS36QTHWAWGK&qid=1581539632&sr=1-2-32a32192-7547-4d9b-b4f8-fe31bfe05040&tag=spyonsite-20","In Stock.",""
"Kasa Smart Light Bulb by TP-Link – WiFi Bulbs, No Hub Required, Old Version, Works with Alexa & Google (LB110)","https://www.amazon.com/TP-Link-LB110-Smart-Wi-Fi-Dimmable/dp/B01HXM8XE2/ref=sxin_0_osp48-aa92a2dc_cov?ascsubtag=aa92a2dc-3c51-4bd4-84ae-194e86169596&creativeASIN=B01HXM8XE2&cv_ct_cx=smart+light&cv_ct_id=amzn1.osp.aa92a2dc-3c51-4bd4-84ae-194e86169596&cv_ct_pg=search&cv_ct_wn=osp-search&keywords=smart+light&linkCode=oas&pd_rd_i=B01HXM8XE2&pd_rd_r=d7ebff29-4c90-446b-976e-e851b5ad6a99&pd_rd_w=yQaj8&pd_rd_wg=xAElo&pf_rd_p=62c00474-6fe0-420f-9956-a05256e04b43&pf_rd_r=28SPZKBDXS36QTHWAWGK&qid=1581539632&sr=1-3-32a32192-7547-4d9b-b4f8-fe31bfe05040&tag=spyonsite-20","In Stock.",""
"Smart LED Light Bulb 2.4G(Not 5G) E26 WiFi Multicolor Light Bulb Work with Alexa,Siri, Echo, Google Home and IFTTT (No Hub Required), A19 60W Equivalent RGB Color Changing Bulb (4 Pack)","https://www.amazon.com/Multicolor-Google-Required-Equivalent-Changing/dp/B07QYMPT6W/ref=sr_1_1?keywords=smart+light&qid=1581539632&sr=8-1","In Stock.","39."
"BERENNIS Smart Light Bulb, A19 E26 RGBCW WiFi Dimmable Multicolor LED Lights, Compatible with Alexa, Google Home and IFTTT (No Hub Required) 7W (60w Equivalent) 3 Pack","https://www.amazon.com/BERENNIS-Dimmable-Multicolored-Required-Compatible/dp/B07GGWNQT7/ref=sr_1_2?keywords=smart+light&qid=1581539632&sr=8-2","In Stock.","29."
"Govee Smart WiFi LED Strip Lights Works with Alexa, Google Home Brighter 5050 LED, 16 Million Colors Phone App Controlled Music Light Strip for Home, Kitchen, TV, Party, for iOS and Android, 16.4ft","https://www.amazon.com/Govee-Brighter-Million-Controlled-Kitchen/dp/B07N1CMGQQ/ref=sr_1_3?keywords=smart+light&qid=1581539632&smid=A2KZ7X05DCDJDL&sr=8-3","In Stock.","25."
"Smart WiFi Light Bulb, LED RGB Color Changing, Compatible with Alexa and Google Home Assistant, No Hub Required, A19 E26 Multicolor LUMIMAN 2 Pack","https://www.amazon.com/Changing-Compatible-Assistant-Multicolor-LUMIMAN/dp/B07DLSNNDS/ref=sr_1_4?keywords=smart+light&qid=1581539632&sr=8-4","In Stock.","22."
"Smart WiFi Light Bulb with Soft White Light, TECKIN 16 Million RGB Color Changing LED Bulb That Work with Alexa, Google Home (No Hub Required), 7.5W (60w Equivalent),4 Pack","https://www.amazon.com/Multicolor-Compatible-Required-TECKIN-Equivalent/dp/B07GT3RXM6/ref=sr_1_5?keywords=smart+light&qid=1581539632&sr=8-5","In Stock.","39."
"Smart LED Light Bulb 2.4G(Not 5G) E26 WiFi Multicolor Light Bulb Work with Siri,Alexa, Echo, Google Home and IFTTT (No Hub Required), Peteme A19 60W Equivalent RGB Color Changing Bulb (2 Pack)","https://www.amazon.com/Multicolor-Required-Peteme-Equivalent-Changing/dp/B07MKDLV1V/ref=sr_1_6?keywords=smart+light&qid=1581539632&sr=8-6","In Stock.","20."
"Smart WiFi Alexa Light Bulbs 2.4G, SAUDIO LED RGB Color Changing Bulbs, Compatible with Siri,Alexa,IFTTT and Google Home Assistant, No Hub Required, A19 E26 Multicolor 4 Pack","https://www.amazon.com/SAUDIO-Changing-Compatible-Assistant-Multicolor/dp/B07RX62616/ref=sr_1_7?keywords=smart+light&qid=1581539632&sr=8-7","In Stock.","39."
"Wyze Bulb 800 Lumen A19 LED Smart Home Light Bulb, Adjustable white temperature and brightness, works with Alexa and the Google Assistant, No Hub Required, 4-Pack","https://www.amazon.com/Wyze-Adjustable-temperature-brightness-Assistant/dp/B07RF9NCDP/ref=sr_1_8?keywords=smart+light&qid=1581539632&sr=8-8","In Stock.","37."
"Kasa Smart Light Switch by TP-Link – Needs Neutral Wire, WiFi Light Switch, Works with Alexa & Google (HS200) White 1-Pack","https://www.amazon.com/Kasa-Smart-Light-Switch-TP-Link/dp/B01EZV35QU/ref=sr_1_9?keywords=smart+light&qid=1581539632&sr=8-9","In Stock.","19."
"Smart Light Bulb Compatible with Alexa Google Home, NiteBird A19 E26 Wifi Dimmable Warm White 2700K LED Lights Bulbs, 75W Equivalent, No Hub Required, 4 Pack","https://www.amazon.com/Compatible-NiteBird-Dimmable-Equivalent-Required/dp/B081SWYGTT/ref=sr_1_10?keywords=smart+light&qid=1581539632&sr=8-10","In Stock.","31."
"Smart Light Bulbs E12 Base LED Candelabra Bulbs, Color Changing and Dimmable, Compatible with Alexa Google Home IFTTT, Tunable White Chandelier Light Bulbs 320 lm 35w Equivalent, 4 Pack","https://www.amazon.com/Candelabra-Changing-Compatible-Chandelier-Equivalent/dp/B07WGL5L8Q/ref=sr_1_11?keywords=smart+light&qid=1581539632&sr=8-11","In Stock.","39."
"Smart Light Bulbs, Aoycocr BR30 Dimmable LED Light Bulbs, 720 Lumen, Tunable White 2700K - 9000K,9 (80W Equivalent) No Hub Required, Wi-Fi, E26 Base (4 Pack)","https://www.amazon.com/Smart-Light-Aoycocr-Dimmable-Tunable/dp/B07VCRJ9ZM/ref=sr_1_12?keywords=smart+light&qid=1581539632&sr=8-12","In Stock.","52."
"Smart Light Bulb Compatible with Alexa Google Home, NiteBird A19 E26 WiFi Dimmable Warm White 2700K LED Lights Bulbs, 75W Equivalent, No Hub Required, 2 Pack","https://www.amazon.com/Compatible-NiteBird-Dimmable-Equivalent-Required/dp/B082DWK146/ref=sr_1_13?keywords=smart+light&qid=1581539632&sr=8-13","In Stock.","16."
"Smart Light Bulb, Works with Alexa, Echo, Google Home and Siri, AL Above Lights Dimmable E26 9W Wi-Fi LED Smart Bulb, Soft White (2700K), 60W Equivalent, 810 LM, RGB+W, ETL Listed - 1 Pack","https://www.amazon.com/AL-Above-Lights-Dimmable-Equivalent/dp/B07SN3MZM7/ref=sr_1_14?keywords=smart+light&qid=1581539632&sr=8-14","In Stock.","13."
"Gosund Smart Light Bulb Compatible with Alexa Google Home WiFi A19 E26 LED Dimmable Bulbs No Hub Required 2700K Warm White 8W Lights 75W Equivalent Lighting 2pack","https://www.amazon.com/Gosund-Dimmable-Required-Equivalent-Lighting/dp/B082X4QTKJ/ref=sr_1_15?keywords=smart+light&qid=1581539632&sr=8-15","In Stock.","16."
"Smart Alexa Light Bulbs, SAUDIO WiFi LED Bulbs RGB Color Changing Bulbs, Compatible with Siri,Alexa,IFTTT and Google Home Assistant, No Hub Required, A19 E26 Multicolor 2 Pack","https://www.amazon.com/SAUDIO-Changing-Compatible-Assistant-Multicolor/dp/B082WT4CPW/ref=sr_1_16?keywords=smart+light&qid=1581539632&sr=8-16","In Stock.","20."
"Light Bulb Camera,Include 16GB Card 1080P WiFi Security Camera, 2MP Wireles IP LED Cam,360 Degrees Panoramic VR Indoor/Outdoor Home Surveillance Cameras,Motion Detection/Night Vision/Alarm","https://www.amazon.com/Include-Security-Panoramic-Surveillance-Detection/dp/B082S9PBHK/ref=sr_1_17?keywords=smart+light&qid=1581539632&sr=8-17","In Stock.","32."
"Philips Hue White 2-Pack A19 LED Smart Bulb, Bluetooth & Zigbee compatible (Hue Hub Optional), Works with Alexa & Google Assistant – A Certified for Humans Device","https://www.amazon.com/Philips-Hue-Bluetooth-compatible-Assistant/dp/B07R2MQ2PY/ref=sr_1_18?keywords=smart+light&qid=1581539632&sr=8-18","In Stock.","29."
"Treatlife Smart Light Switch（Neutral Wire Required), 2.4Ghz Wi-Fi Light Switch, Works with Alexa and Google Assistant, Schedule, Remote Control, Single Pole, ETL Listed (4 PACK)","https://www.amazon.com/Treatlife-Smart-Light-Switch-Assistant/dp/B07R4MFWCQ/ref=sr_1_19?keywords=smart+light&qid=1581539632&sr=8-19","In Stock.","59."
"Smart Light Bulb Alexa LED Color Changing Light Bulbs,TECKIN A19 E27 60W 800LM Equivalent Compatible with Google Home,IFTTT,2800K-6000K Cold and Warm Light WiFi Blubs(7.5W),2pack","https://www.amazon.com/Changing-TECKIN-Equivalent-Compatible-2800K-6000K/dp/B07ZJHKC8W/ref=sr_1_20?keywords=smart+light&qid=1581539632&sr=8-20","In Stock.","24."
"Amazon Smart Plug, works with Alexa – A Certified for Humans Device","https://www.amazon.com/Amazon-Smart-Plug-works-Alexa/dp/B01MZEEFNX/ref=sr_1_21?keywords=smart+light&qid=1581539632&sr=8-21","In Stock.","24."
"OHLUX Smart WiFi LED Light Bulbs Compatible with Alexa Google Home and IFTTT(No Hub Required), RGBCW Multi-Color, Warm to Cool White Dimmable, 60W Equivalent, 7W E26 A19 Color Changing Bulb-4PACK","https://www.amazon.com/OHLUX-Compatible-Equivalent-Multi-Color-Bulb-4PACK/dp/B07LCB3HQJ/ref=sr_1_22?keywords=smart+light&qid=1581539632&sr=8-22","In Stock.","39."
"Smart Light Bulb with Soft White Light 2800k-6200k + RGBW, TECKIN A19 WiFi Multicolor LED Bulb Compatible with Phone, Google Home, 8w (60w Equivalent),2 Pack","https://www.amazon.com/Dimmable-Multicolor-Compatible-TECKIN-Equivalent/dp/B07GT2Q5RW/ref=sr_1_23?keywords=smart+light&qid=1581539632&sr=8-23","In Stock.","23."
"Smart WiFi Light Bulb, LUMIMAN LED RGBCW Color Changing, Compatible with Alexa, Siri and Google Home Assistant, No Hub Required, A19 E26 Multicolor 4 Pack","https://www.amazon.com/LUMIMAN-Changing-Compatible-Assistant-Multicolor/dp/B07XYXY5QR/ref=sr_1_24?keywords=smart+light&qid=1581539632&sr=8-24","In Stock.","39."
"TECKIN Smart Light Bulb LED RGB Color Changing,A19 E27 60W 800LM Equivalent Compatible with Alexa Google Home,IFTTT,2800K-6000K Cold and Warm Light WiFi Blubs(7.5W),4pack","https://www.amazon.com/TECKIN-Changing-Equivalent-Compatible-2800K-6000K/dp/B07ZJHGQZ2/ref=sr_1_25?keywords=smart+light&qid=1581539632&sr=8-25","In Stock.","39."
"Dusk to Dawn Light Bulb Sensor Smart LED Outdoor Lighting Bulbs Lamp 7W E26/E27 Automatic On/Off, Indoor/Outdoor Yard Porch Patio Garden (Warm White, 3 Pack)","https://www.amazon.com/Sensor-Outdoor-Lighting-Automatic-Indoor/dp/B077SQ95ZW/ref=sr_1_26?keywords=smart+light&qid=1581539632&sr=8-26","In Stock.","21."
"Philips Hue White and Color Ambiance LightStrip Plus Dimmable LED Smart Light (Requires Hue Hub, Works with Alexa, HomeKit & Google Assistant)","https://www.amazon.com/Philips-Ambiance-LightStrip-Compatible-Assistant/dp/B0167H33DU/ref=sr_1_27?keywords=smart+light&qid=1581539632&sr=8-27","In Stock.","79."
"WeMo Smart Light Switch 2ND Gen","https://www.amazon.com/WeMo-Smart-Light-Switch-2ND/dp/B07RT8H9WH/ref=sr_1_28?keywords=smart+light&qid=1581539632&sr=8-28","In Stock.","39."
"Kasa Smart WiFi Plug by TP-Link – Smart Plug, No Hub Required, Works with Alexa and Google (HS100), white, 1 Pack","https://www.amazon.com/TP-Link-HS100-Required-Google-Assistant/dp/B0178IC734/ref=sr_1_29?keywords=smart+light&qid=1581539632&sr=8-29","In Stock.","16."
"Smart Switch, SAUDIO Smart Light Dimmer Switch for Dimmable LED/Halogen/Incandescent Bulbs, Compatible with Alexa, Google Assistant/IFTTT, Remote Control, Single-Pole, Neutral Wire Required(1 Pack)","https://www.amazon.com/SAUDIO-Incandescent-Compatible-Assistant-Single-Pole/dp/B082WR6VDJ/ref=sr_1_30?keywords=smart+light&qid=1581539632&sr=8-30","In Stock.","25."
"Smart Light Switch&Alexa Smart Double Switch& 2.4Ghz WIFI Light Switch With Timer and Remote Control,Schedule,Neutral Wire Needed,Works with Alexa, Google Assistant and IFTTT,Single Pole (2gang)","https://www.amazon.com/Switch-Double-Remote-Control-required/dp/B07QRRRTDM/ref=sr_1_31?keywords=smart+light&qid=1581539632&sr=8-31","In Stock.","36."
"Smart Light Bulbs, Aoycocr BR30 Dimmable LED Light Bulbs, 720 Lumen, Tunable White 2700K - 9000K,9 (80W Equivalent), Works with Alexa, Google Assistant, IFTTT, No Hub Required, Wi-Fi, E26 Base, 6 Pack","https://www.amazon.com/Smart-Light-Aoycocr-Dimmable-Tunable/dp/B07VP2KL7W/ref=sr_1_32?keywords=smart+light&qid=1581539632&sr=8-32","In Stock.","80."
"Smart Light Bulb WiFi Light Bulbs,TECKIN 13W E27 RGBCW Multicolor Dimmable LED Color Changing Light Bulb Equivalent 100W,1300LM BR30 Compatible with Alexa and Google Home IFTTT 2900K-6000K 2 Packs","https://www.amazon.com/TECKIN-Multicolor-Equivalent-Compatible-2900K-6000K/dp/B07Z8X6VQZ/ref=sr_1_33?keywords=smart+light&qid=1581539632&sr=8-33","In Stock.","37."
"Smart LED Light Bulb, Dimmable WiFi Smart Bulb with Warm Lights - No Hub Required, Christmas Smart Bulb Works with Alexa Echo Dot, Google Home Mini & Samsung, KHSUIN LED Smart Light Bulbs 7W (80W)","https://www.amazon.com/Smart-Light-Bulb-Dimmable-Lights/dp/B07WS6SK2X/ref=sr_1_34?keywords=smart+light&qid=1581539632&sr=8-34","In Stock.","19."
"TECKIN Smart Light Bulb,LED RGB Color Changing,E27 100W 1300LM Equivalent Compatible with Alexa and Google Home,IFTTT,2900K-6000K BR30 WiFi Light Blubs(13W),1 Pack","https://www.amazon.com/TECKIN-Changing-Equivalent-Compatible-2900K-6000K/dp/B07RZKV7FQ/ref=sr_1_35?keywords=smart+light&qid=1581539632&sr=8-35","In Stock.","19."
"Samsung SMARTBULB/GP-LBU019BBAWU / GP-LBU019BBAWU / Smart Light Bulb SmartThings Dimmable Light Bulb/SmartThings Hub Required","https://www.amazon.com/Samsung-SMARTBULB-GP-LBU019BBAWU-SmartThings-Dimmable/dp/B07Q1DLSBN/ref=sr_1_36?keywords=smart+light&qid=1581539632&sr=8-36","In Stock.","9."
"Smart Led Light Bulb, Alexa RGB Color Changing Light Bulb, TECKIN E27 A19 60W Equivalent, Compatible with Alexa, Google Home and IFTTT, Cold and Warm Light 2800K-6000K, WiFi Control Bulb (2 Packs)","https://www.amazon.com/Changing-TECKIN-Equivalent-Compatible-2800K-6000K/dp/B081JTDZXT/ref=sr_1_37?keywords=smart+light&qid=1581539632&sr=8-37","In Stock.","23."
"Kasa Smart WiFi Light Bulb, Dimmable by TP-Link – No Hub Required, Works with Alexa & Google (KL110)","https://www.amazon.com/Kasa-Smart-Light-Dimmable-TP-Link/dp/B07G1PH3JL/ref=sr_1_38?keywords=smart+light&qid=1581539632&sr=8-38","In Stock.","16."
"Smart Light Bulb Works with Alexa Google Home, NiteBird A19 E26 WiFi Multicolor Dimmable LED Lights Bulbs, 2700k + RGB, 75W Equivalent, No Hub Required, 4 Pack","https://www.amazon.com/TanTan-Smart-Bulb/dp/B07MTYVSSV/ref=sr_1_39?keywords=smart+light&qid=1581539632&sr=8-39","In Stock.","35."
"Treatlife Smart Light Switch（Neutral Wire Required), 2.4Ghz Wi-Fi Light Switch, Works with Alexa and Google Assistant, Schedule, Remote Control, Single Pole, ETL Listed (1 PACK)","https://www.amazon.com/Treatlife-Smart-Light-Switch-Assistant/dp/B07R7PCCT9/ref=sr_1_40?keywords=smart+light&qid=1581539632&sr=8-40","In Stock.","17."
"Kasa 3-way Smart Light Switch, WiFi Smart Switch Works with Alexa Echo & Google Home, No Hub Required, Neutral Wire Needed (HS210)","https://www.amazon.com/Switch-Google-Required-Neutral-HS210/dp/B083JKTMYQ/ref=sr_1_41?keywords=smart+light&qid=1581539632&sr=8-41","In Stock.","24."
"3-way Smart Light Switch, Neutral Wire Required, Treatlife WiFi Light Switch Single Pole/3-way Switch Works With Alexa, Google Assistant, Remote Control, ETL, Schedule, 1 PACK","https://www.amazon.com/Treatlife-Assistant-Control-Schedule-Required/dp/B07V4X7BRT/ref=sr_1_42?keywords=smart+light&qid=1581539632&sr=8-42","In Stock.","27."
"TP-Link Kasa Smart WiFi Light Bulb, Multicolor - Smart LED Light Bulbs, Works with Alexa & Google (KL130)","https://www.amazon.com/Kasa-Smart-Light-Multicolor-TP-Link/dp/B07FZ6PLJG/ref=sr_1_43?keywords=smart+light&qid=1581539632&sr=8-43","In Stock.","29."
"NiteBird Smart TV Backlight Work with Alexa Google Home,Sync to Music WiFi LED TV light 9.2Ft Kit for 32'' to 60'' TV, Waterproof 5050 RGB Strip Light with Controller, Dimmable","https://www.amazon.com/NiteBird-Backlight-Waterproof-Controller-Dimmable/dp/B07XCVGL42/ref=sr_1_44?keywords=smart+light&qid=1581539632&sr=8-44","In Stock.","17."
"Philips Hue Go Portable Table Lamp","https://www.amazon.com/Philips-Hue-Portable-Dimmable-Assistant/dp/B00UVHAC1O/ref=sr_1_45?keywords=smart+light&qid=1581539632&sr=8-45","Available from these sellers.",""
"Wemo Wi-Fi Light Switch 3-Way 2-Pack Bundle - Control Lighting from Anywhere, Easy In-Wall Installation, Works with Alexa, Google Assistant and Apple HomeKit (WLS0403-BDL)","https://www.amazon.com/Wi-Fi-Light-Switch-2-Pack-Bundle/dp/B07NPZVYR1/ref=sr_1_46?keywords=smart+light&qid=1581539632&sr=8-46","In Stock.","77."
"Smart LED RGB Light Bulb - Aoycocr 10W A21 E26 Soft White (2700K) Multicolor - 900 Lumens (85W Equivalent) - Compatible with Amazon Alexa and Google Assistant, No Hub Required (4 Pack)","https://www.amazon.com/Smart-LED-RGB-Light-Bulb/dp/B07T8DRZZ5/ref=sr_1_47?keywords=smart+light&qid=1581539632&sr=8-47","In Stock.","40."
"Bali Women's Comfort Revolution Wirefree Bra with Smart Sizes Bra","https://www.amazon.com/Bali-Womens-Comfort-Revolution-Wirefree/dp/B00BNBBHW0/ref=sr_1_48?dchild=1&keywords=smart+light&qid=1581539632&sr=8-48","","16."
"LED Candelabra Bulbs E12 Base, Color Changing and Dimmable Smart Light Bulb, Compatible with Alexa Google Home IFTTT, Tunable White Chandelier Light Bulbs 320 lm 35w Equivalent, 3 Pack","https://www.amazon.com/Candelabra-Changing-Compatible-Chandelier-Equivalent/dp/B081L4Q5HH/ref=sr_1_49?keywords=smart+light&qid=1581540256&sr=8-49","In Stock.","28."
"Sengled Smart Light Bulb A19 LED Daylight, Hub Required, Smart Bulb A19 5000K 60W Equivalent, Smart Light Bulb Compatible with Alexa, Google Assistant, SmartThings & IFTTT, 2 Pack","https://www.amazon.com/Sengled-Equivalent-Compatible-Assistant-SmartThings/dp/B07Y4ZNJTX/ref=sr_1_50?keywords=smart+light&qid=1581540256&sr=8-50","In Stock.","19."
"[2020 Upgrade] 100W Equivalent Smart LED Light Bulb 2.4G(Not 5G) A21 by 3Stone, WiFi App Controlled UL Listed, Dimmable Warm White and RGB Colors, Works Perfect with Amazon Alexa Google Assistant","https://www.amazon.com/3Stone-Controlled-Dimmable-Equivalent-Assistant/dp/B07HR8GT12/ref=sr_1_51?keywords=smart+light&qid=1581540256&sr=8-51","In Stock.","41."
"Smart LED Light Bulb, TIKLOK WiFi Dimmable Soft White A19 E26 Bulb, Compatible with Alexa and Google Home, 2700K 60W Equivalent, Easy Setup Control, No Hub Required (4 Pack)","https://www.amazon.com/Dimmable-Compatible-Equivalent-Control-Required/dp/B07XB5C6SC/ref=sr_1_52?keywords=smart+light&qid=1581540256&sr=8-52","In Stock.","31."
"UPGRADED WiFi Smart LED Strip Lights 16.4ft Works with Alexa, Google Home Extra-Adhesive Bright 5050 LED, 16 Million Colors Phone App Controlled Strip for Home, Kitchen, TV, Party, for iOS and Android","https://www.amazon.com/TBI-Pro-Extra-Adhesive-Million-Controlled/dp/B07TNNMDBK/ref=sr_1_53?keywords=smart+light&qid=1581540256&sr=8-53","In Stock.","29."
"LOHAS Smart Light Bulb BR40 WiFi LED Bulb, E26 RGB Color Changing Lights, 1450LM 100W Equivalent WiFi Bulb Work with Alexa, Google Assistant, Daylight 2700K-6000K Bulbs for Home Lighting(15W), 1 Pack","https://www.amazon.com/LOHAS-LED-Equivalent-2700K-6000K-Home-Lighting/dp/B082QVJBTD/ref=sr_1_54?keywords=smart+light&qid=1581540256&sr=8-54","In Stock.","26."
"LE LampUX Smart LED Light Bulb, E12 Candelabra Light Bulbs, Works with Alexa Google Home, Tunable White 2700K-6500K, Dimmable with App, No Hub Required, 40 Watt Equivalent, 2.4GHz WiFi, Pack of 2","https://www.amazon.com/Candelabra-2700K-6500K-Dimmable-Required-Equivalent/dp/B07RSQW16R/ref=sr_1_55?keywords=smart+light&qid=1581540256&sr=8-55","In Stock.","22."
"SYLVANIA General Lighting 74768 SYLVANIA SMART (Formerly LIGHTIFY) On/Off/Dim LED Light Bulb, 60W Equivalent A19, 10 Year, Works with Amazon Alexa, SmartThings and Wink (4 Pack), Soft White, 4 Piece","https://www.amazon.com/Sylvania-Smart-Home-74768-SmartThings/dp/B07576J38L/ref=sr_1_56?keywords=smart+light&qid=1581540256&sr=8-56","In Stock.","16."
"Smart LED Light Bulb, Alexa Light Bulbs WiFi Dimmable 2 Pack Work with Google Home/Smart Life APP, Avatar Controls RGBW Color Changing Lights, No Hub Required (910LM E26 A19 8W=70W Equivalent)","https://www.amazon.com/Dimmable-Avatar-Controls-Changing-Equivalent/dp/B07SBPBDZW/ref=sr_1_57?keywords=smart+light&qid=1581540256&sr=8-57","In Stock.","19."
"AXTEE Smart Light Bulb 2.4G(Not 5G), WiFi LED RGBCW Color Changing Bulbs 2700K-6500K with White Lights Work with Alexa, Echo, Google Home and IFTTT(No Hub Required), A19 E26 60W Equivalent-3 Pack","https://www.amazon.com/Dimmable-Multicolored-Required-Amazon-Google/dp/B07G5M8FKG/ref=sr_1_58?keywords=smart+light&qid=1581540256&sr=8-58","In Stock.","27."
"Smart Light Bulbs, LOHAS BR30 LED WiFi Light Bulb Dimmable Daylight 5000K, 980LM, Compatible with Alexa Google Home Assistant, E26 10W Equivalent 75W BR30 Flood Light for Cans, No Hub Required, 2Pack","https://www.amazon.com/LOHAS-LED-Dimmable-Equivalent-Compatible/dp/B07SWYN9WS/ref=sr_1_59?keywords=smart+light&qid=1581540256&sr=8-59","In Stock.","23."
"LOHAS Smart LED Bulbs, Candelabra Base E12 LED Bulb Dimmable Smart Daylight 50 Watt Equivalent, 5000K LED WiFi Bulb No Hub Required Work with Alexa Google Home for chandelier ceiling fan bulbs, 4 Pack","https://www.amazon.com/LOHAS-LED-Candelabra-Equivalent-chandelier/dp/B07ZCND9FM/ref=sr_1_60?keywords=smart+light&qid=1581540256&sr=8-60","In Stock.","36."
"Etekcity Smart Light Bulb, WiFi Dimmable Soft White LED Bulb Works with Alexa, Google Home and IFTTT, Easy Setup, Schedule, A19 E26, 60W Equivalent, 806LM, 2700K, No Hub Required, UL Listed (4 Pack)","https://www.amazon.com/Etekcity-Dimmable-Schedule-Required-Equivalent/dp/B07TYV2BNF/ref=sr_1_61?keywords=smart+light&qid=1581540256&sr=8-61","In Stock.","43."
"OHLUX Smart WiFi LED Light Bulb, Works with Alexa and Google Home Assistant (No Hub Required), RGBCW Multi Color Changing Bulb, A19 E26 7W(60W Equivalent), IFTTT Compatible, 2-Pack","https://www.amazon.com/OHLUX-Assistant-Required-Equivalent-Compatible/dp/B07VVW7BZ9/ref=sr_1_62?keywords=smart+light&qid=1581540256&sr=8-62","In Stock.","21."
"Treatlife Smart Light Switch（Neutral Wire Required) , 2.4Ghz Wi-Fi Light Switch, Works with Alexa and Google Assistant, Schedule, Remote Control, Single Pole, ETL Listed (2 PACK)","https://www.amazon.com/Treatlife-Smart-Light-Switch-Assistant/dp/B07SB5RW14/ref=sr_1_63?keywords=smart+light&qid=1581540256&sr=8-63","In Stock.","32."
"DAYBETTER LED Strip Lights, Smart LED Lights 16.4ft Waterproof 5050 RGB Color Changing Controlled by Phone APP, Sync to Music, WiFi LED Strips Work with Alexa, Google Assistant for Bedroom","https://www.amazon.com/DAYBETTER-Waterproof-Changing-Controlled-Assistant/dp/B07VNG9ZLM/ref=sr_1_64?keywords=smart+light&qid=1581540256&sr=8-64","In Stock.","26."
"LED Candelabra Bulbs E12 Base- Chandelier Lighting Bulbs 400 Lumens 5W(45 Watt equiv.) - Tunable White 2000K-6500K RGB Color Changing Dimmable Smart Light Bulb - 3 Pack","https://www.amazon.com/Candelabra-Chandelier-Lighting-Lumens-equiv/dp/B07YFTKCQC/ref=sr_1_65?keywords=smart+light&qid=1581540256&sr=8-65","In Stock.","29."
"Smart WiFi LED Recessed Retrofit Downlight 5/6 inch, 15W Ceiling Down Lighting Compatible with Alexa,Siri and Google Home, RGBCW Multicolor Color Changing Retrofit Can Lights 2700K - 6500K No Hub","https://www.amazon.com/Recessed-Retrofit-Downlight-Compatible-Multicolor/dp/B07WS5L5LR/ref=sr_1_66?keywords=smart+light&qid=1581540256&sr=8-66","In Stock.","39."
"Gosund Smart Dimmer Switch, Wifi Wall Light Switch Compatible with Alexa and Google Home, 4 Pack, Single-Pole, Remote Control, No Hub Required, ETL and FCC Listed","https://www.amazon.com/Gosund-Compatible-Single-Pole-Control-Required/dp/B07VP4PHJJ/ref=sr_1_67?keywords=smart+light&qid=1581540256&sr=8-67","In Stock.","75."
"Smart Light Bulbs,TECKIN LED RGB Color Changing,E27 100W 1300LM Equivalent Compatible with Alexa and Google Home,IFTTT,2900K-6000K BR30 WiFi Light Blubs(13W),4 Pack","https://www.amazon.com/TECKIN-Changing-Equivalent-Compatible-2900K-6000K/dp/B07ZFSW1YJ/ref=sr_1_68?keywords=smart+light&qid=1581540256&sr=8-68","In Stock.","69."
"TP-Link (HS220) Kasa Smart Dimmer WiFi Light Switch, 1-Pack","https://www.amazon.com/TP-Link-HS220-Dimmer-Switch-1-Pack/dp/B079775ZZQ/ref=sr_1_69?keywords=smart+light&qid=1581540256&sr=8-69","In Stock.","29."
"Smart Light Switch, Treatlife 2.4Ghz Smart Switch Wi-Fi Light Switch, Neutral Wire Required, Works with Alexa and Google Assistant, Single-Pole, Schedule, Remote Control, ETL Listed, 4 PACK","https://www.amazon.com/Treatlife-Required-Assistant-Single-Pole-Schedule/dp/B07WWYQJFR/ref=sr_1_70?keywords=smart+light&qid=1581540256&sr=8-70","In Stock.","64."
"The Body Keeps the Score: Brain, Mind, and Body in the Healing of Trauma","https://www.amazon.com/Body-Keeps-Score-Healing-Trauma/dp/0143127748/ref=sr_1_71?keywords=smart+light&qid=1581540256&sr=8-71","In Stock.","10."
"Gosund Smart Dimmer Switch, Smart Light Switch Dimmer Compatible with Alexa & Google Home, with Remote Control & Timer, Single-Pole, Neutral Wire Required, ETL & FCC Listed, No Hub Required (1 Pack)","https://www.amazon.com/Gosund-Compatible-Control-Single-Pole-Required/dp/B07WSSTVL5/ref=sr_1_72?keywords=smart+light&qid=1581540256&sr=8-72","In Stock.","20."
"Philips Hue White A19 4-Pack 60W Equivalent Dimmable LED Smart Bulbs (Hue Hub Required, Works with Alexa, HomeKit & Google Assistant), Old Version","https://www.amazon.com/Philips-Hue-Equivalent-Compatible-Assistant/dp/B073SSK6P8/ref=sr_1_73?keywords=smart+light&qid=1581540256&sr=8-73","In Stock.","49."
