"product_name","product_url","product_instock","product_price"
"AISIRER Smart Light Bulb WiFi LED Bulbs 9W 806LM Compatible with Amazon Alexa Echo Google Home Assistant and IFTTT Dimmable Warm Light 2700K No Hub Required E26 A19","https://www.amazon.com/Compatible-Assistant-Equivalent-Dimmable-AISIRER/dp/B07Q3SGYCL/ref=sr_1_74?keywords=smart+light&qid=1581540256&sr=8-74","In Stock.","22."
"Philips Hue White LED Smart Light Bulb Starter Kit, 3 A19 Smart Bulbs & 1 Hue Hub, (Works with Alexa, Apple HomeKit, and Google Assistant)","https://www.amazon.com/Philips-Hue-Starter-HomeKit-Assistant/dp/B07QZHMM4P/ref=sr_1_75?keywords=smart+light&qid=1581540256&sr=8-75","In Stock.","65."
"Smart plug, Gosund Mini Wifi Outlet Works With Alexa, Google Home & IFTTT, No Hub Required, Remote Control Your Home Appliances from Anywhere, ETL Certified,Only Supports 2.4GHz Network(4 Pieces)","https://www.amazon.com/Gosund-Compatible-Required-appliances-Certified/dp/B079MFTYMV/ref=sr_1_76?keywords=smart+light&qid=1581540256&sr=8-76","In Stock.","29."
"Gosund Smart Light Switch, In-wall Wifi Smart Switch that Works with Alexa and Google Home, No Hub Required, Neutral Wire Needed, Single-Pole 15A, ETL and FCC Listed,4 Pack White","https://www.amazon.com/TanTan-Compatible-Single-Pole-required-Control/dp/B07MV1RTSV/ref=sr_1_77?keywords=smart+light&qid=1581540256&sr=8-77","In Stock.","59."
"Kasa Smart Light Bulb by TP-Link – WiFi Bulbs, No Hub Required, Old Version, Works with Alexa & Google (LB110)","https://www.amazon.com/TP-Link-LB110-Smart-Wi-Fi-Dimmable/dp/B01HXM8XE2/ref=sr_1_78?keywords=smart+light&qid=1581540256&sr=8-78","In Stock.","19."
"Smart LED Strip Lights Gosund Led Lights Works with Alexa and Google Home, 5050 RGB Color Changing Lights for Bedroom WiFi Remote Control Smart Tape Lights Sync with Music, 16 Million Colors, 16.4ft","https://www.amazon.com/Gosund-Changing-Bedroom-Control-Million/dp/B082119W8V/ref=sr_1_79?keywords=smart+light&qid=1581540256&sr=8-79","In Stock.","25."
"LE LampUX BR30 E26 WiFi Smart Light Bulbs Alexa Google Home Compatible, RGBW Color Changing/Tunable White (Warm to Daylight), 9W=65W, Dimmable Recessed Flood Can Light Bulbs, No Hub Required, 2 Packs","https://www.amazon.com/Compatible-Changing-Daylight-Dimmable-Recessed/dp/B07WQW3X5Q/ref=sr_1_80?keywords=smart+light&qid=1581540256&sr=8-80","In Stock.","27."
"Sunco Lighting 6 Pack WiFi LED Smart Bulb, BR30, 8W, Color Changing (RGB & CCT), Dimmable, 650 LM, Compatible with Amazon Alexa & Google Assistant - No Hub Required","https://www.amazon.com/Sunco-Lighting-Changing-Compatible-Assistant/dp/B07L53J864/ref=sr_1_81?keywords=smart+light&qid=1581540256&sr=8-81","In Stock.","64."
"Smart LED Light Bulb - No Hub Required, Smart Bulb Compatible with Alexa Echo Dot, Google Home Mini & Samsung, KHSUIN LED Smart Light Bulbs 7W (80W)","https://www.amazon.com/Smart-LED-Light-Bulb-Compatible/dp/B083FRDH5S/ref=sr_1_82?keywords=smart+light&qid=1581540256&sr=8-82","In Stock.","8."
"Treatlife Smart Dimmer Switch, Neutral Wire Needed, 2.4Ghz Wi-Fi Light Switch, Compatible with Alexa and Google Assistant, Schedule, Remote Control, Single Pole (1 PACK)","https://www.amazon.com/Treatlife-Neutral-Compatible-Assistant-Schedule/dp/B07YKGMXDM/ref=sr_1_83?keywords=smart+light&qid=1581540256&sr=8-83","In Stock.","23."
"TECKIN LED Smart Bulb Alexa Light Bulbs, RGB Dimmable Multicolor Bulbs E27 A19 60W Equivalent, Compatible with Alexa, Google Home and IFTTT, Cold and Warm Light 2800K-6000K, Wifi Control Bulb (4 Packs","https://www.amazon.com/TECKIN-Multicolor-Equivalent-Compatible-2800K-6000K/dp/B081JT9YNP/ref=sr_1_84?keywords=smart+light&qid=1581540256&sr=8-84","In Stock.","41."
"Smart Light Switch, Yeewell 2.4Ghz WiFi Light Switch with Timer and Remote Control, Works with Alexa, Google home and IFTTT, Neutral Wire Needed, Single Pole, No Hub Required, 2 gang","https://www.amazon.com/Switch-Yeewell-Control-Neutral-Required/dp/B07WR81VPC/ref=sr_1_85?keywords=smart+light&qid=1581540256&sr=8-85","In Stock.","36."
"LED Strip Lights, DAYBETTER 16.4 FT Smart Strip Lights 5050 Kit 150 LEDs Work with Alex Google Assistant WiFi Rope Light APP Controlled Smart Light Strip for Bedroom, Home, Ceiling, Cupboard Lighting","https://www.amazon.com/DAYBETTER-Assistant-Controlled-Cupboard-Lighting/dp/B07VQT4HR2/ref=sr_1_86?keywords=smart+light&qid=1581540256&sr=8-86","In Stock.","24."
"Smart Light Bulb BITIWEND WiFi Smart LED Bulb E26 RGBW Dimmable Smart Color Light Bulb with Remote Control 350lm Compatible with Alexa Google Home,No Hub Required,2 Pack LED Smart Bulbs","https://www.amazon.com/BITIWEND-Dimmable-Control-Compatible-Required/dp/B07YCFSSY9/ref=sr_1_87?keywords=smart+light&qid=1581540256&sr=8-87","In Stock.","19."
"Etekcity Smart Light, WiFi Dimmable Soft White LED Bulb Work with Alexa, Google Home and IFTTT, Easy Setup, Schedule, A19 E26, 60W Equivalent, 806LM, 2700K, No Hub Required, UL Listed","https://www.amazon.com/Etekcity-Smart-Light-WiFi-LED/dp/B07MVWJG3T/ref=sr_1_88?keywords=smart+light&qid=1581540256&sr=8-88","In Stock.","13."
"BATHEBRIGHT Smart WiFi LED Strip Lights Work with Alexa, Google Assistant 16.4ft 5050 RGB LED Strip Colors Changing Controlled by Phone APP LED Light Strip for Room, Kitchen, TV, Party Decoration","https://www.amazon.com/BATHEBRIGHT-Assistant-Changing-Controlled-Decoration/dp/B083DDJKMP/ref=sr_1_89?keywords=smart+light&qid=1581540256&sr=8-89","In Stock.","18."
"WiFi Smart Light Bulb(60W Equivalent) A19 E26 Multicolor LED Compatible with Alexa,Google Home and IFTTT, No Hub Required,RGB Hue Color Changing ＆ Soft White Light ＆ Daylight 3000K-6000K 7W 600LM","https://www.amazon.com/Equivalent-Multicolor-Compatible-Required-3000K-6000K/dp/B07VD9KC9S/ref=sr_1_90?keywords=smart+light&qid=1581540256&sr=8-90","In Stock.","10."
"True Blood: Season 2","https://www.amazon.com/Keep-This-Party-Going/dp/B003NVHI8U/ref=sr_1_91?keywords=smart+light&qid=1581540256&sr=8-91","","2."
"meross Smart Wi-Fi LED Bulb, Multiple Colors, RGB, 810 Lumens 60W Equivalent, Compatible with Alexa, Google Assistant and IFTTT, E26 Light Bulb, No Hub Required - Upgrade Versions (4 Pack)","https://www.amazon.com/meross-Multiple-Equivalent-Compatible-Assistant/dp/B07WNT93HX/ref=sr_1_92?keywords=smart+light&qid=1581540256&sr=8-92","In Stock.","38."
"Smart Switch, Gosund Smart Switch Works with Alexa, Google home and IFTTT, with Remote Control and Schedule, Neutral Wire Required, Single-Pole, No Hub required, ETL and FCC listed","https://www.amazon.com/Gosund-Control-required-installation-listed/dp/B07DQDNBZ2/ref=sr_1_93?keywords=smart+light&qid=1581540256&sr=8-93","In Stock.","17."
"Smart Dimmer Switch,Neutral Wire Required,Treatlife WiFi Light Switch for Dimmable LED, Halogen and Incandescent Bulbs, Compatible with Alexa, Google Assistant, Remote Control, Single-Pole(1 Pack)","https://www.amazon.com/Upgraded-Separable-Replaceable-Function-Dressing/dp/B07CKNWGN4/ref=sr_1_94?keywords=smart+light&qid=1581540256&sr=8-94","In Stock.","24."
"NiteBird Smart LED Strip Lights Works with Alexa Google Home, 16.4ft 5050 RGB WiFi Dimmable Flexible Strip Tape Light, Sync to Music, Waterproof, No Hub Required for Room Kitchen Home Bar TV Party","https://www.amazon.com/NiteBird-Dimmable-Flexible-Waterproof-Required/dp/B081F46JSY/ref=sr_1_95?keywords=smart+light&qid=1581540256&sr=8-95","In Stock.","25."
"Sengled Smart LED Soft White A19 Light Bulb, Hub Required, 2700K 60W Equivalent, Works with Alexa, Google Assistant & SmartThings, 4 Pack","https://www.amazon.com/Sengled-Required-Equivalent-Assistant-SmartThings/dp/B072M5RT6L/ref=sr_1_96?keywords=smart+light&qid=1581540256&sr=8-96","In Stock.","38."
"GE 46201 Enbrighten Z-Wave Plus Smart Light Switch with QuickFit and SimpleWire, Works with Alexa, Google Assistant, Zwave Hub Required, Repeater/Range Extender, 3-Way 2nd Gen, White & Light Almond","https://www.amazon.com/GE-Enbrighten-SimpleWire-SmartThings-46201/dp/B07RRBT6W5/ref=sr_1_97?keywords=smart+light&qid=1581540844&sr=8-97","In Stock.","39."
"Smart LED WiFi Light Bulb, LOHAS LED 2700K-6000K Daylight RGB A19 Bulb Color Changing 60W Equivalent, Dimmable LED E26 Bulbs Works with Alexa, Google Home, Siri (No Hub Required), UL Listed, 4 Pack","https://www.amazon.com/LED-LOHAS-2700K-6000K-Daylight-Equivalent/dp/B07T7W7ZMW/ref=sr_1_98?keywords=smart+light&qid=1581540844&sr=8-98","In Stock.","39."
"Philips Hue Smart Button for Hue Smart Lights, Smart Light Control, (Hue Hub required)","https://www.amazon.com/Philips-Hue-Button-Control-required/dp/B07XV1HRVZ/ref=sr_1_99?keywords=smart+light&qid=1581540844&sr=8-99","In Stock.","19."
"Sengled Smart LED Soft White A19 Light Bulb, Hub Required, 2700K 60W Equivalent, Works with Alexa, Google Assistant & SmartThings, 1 Pack","https://www.amazon.com/Sengled-E11-G13W-Equivalent-Assistant-SmartThings/dp/B01N7I4X94/ref=sr_1_100?keywords=smart+light&qid=1581540844&sr=8-100","In Stock.","9."
"Hedynshine 33 Ft LED Strip Lights, Waterproof Tape Lights with 300 LEDs SMD 5050 RGB Rope Lights, Sync to Music, 24 Key Remote Control and Compatible with Alexa/Google Home,WiFi LED Lights Strip","https://www.amazon.com/Hedynshine-Lights-Waterproof-Control-Compatible/dp/B07KVW8MZY/ref=sr_1_101?keywords=smart+light&qid=1581540844&sr=8-101","In Stock.","38."
"Philips Hue Single Premium A19 Smart Bulb, 16 million colors, for most lamps & overhead lights (Hue Hub Required, Works with Alexa), Old Version","https://www.amazon.com/Philips-464487-Equivalent-Compatible-Assistant/dp/B01M9AU8MB/ref=sr_1_102?keywords=smart+light&qid=1581540844&sr=8-102","","49."
"WiFi Smart Light Bulb Works with Alexa Google Home & IFTTT, Gosund 800LM A19 E26 LED Smart Bulb 2700K RGB Color Changing Dimmable, No Hub Required, Soft White (4 Pack)","https://www.amazon.com/Google-Gosund-Changing-Dimmable-Required/dp/B07PMWX4RB/ref=sr_1_103?keywords=smart+light&qid=1581540844&sr=8-103","In Stock.","37."
"CT Capetronix Smart WiFi LED Light Bulb - A19 E26 RGB+CCT Multicolor Dimmable 2700K-7000K Light Bulbs Compatible with Alexa Echo Google Home Siri (No Hub Required), 8W (60W Equivalent), 2 Pack","https://www.amazon.com/CT-Capetronix-Smart-WiFi-Light/dp/B082B21F2Z/ref=sr_1_104?keywords=smart+light&qid=1581540844&sr=8-104","In Stock.","21."
"NiteBird Smart Light Bulb Works with Alexa Google Home A19 E26 WiFi Multicolor Dimmable LED Lights Bulbs, 2700k + RGB, 75W Equivalent, No Hub Required, 4 Pack","https://www.amazon.com/NiteBird-Multicolor-Dimmable-Equivalent-Required/dp/B0824HJ4NN/ref=sr_1_105?keywords=smart+light&qid=1581540844&sr=8-105","In Stock.","39."
"Sylvania Lightify 65W LED Smart Home 2700-6500K Color/White Light Bulb (2 Pack) (5 Pack)","https://www.amazon.com/Sylvania-Lightify-Smart-2700-6500K-Color/dp/B07H9HKLFR/ref=sr_1_106?keywords=smart+light&qid=1581540844&sr=8-106","In Stock.","114."
"Smart WiFi LED Light Bulbs Compatible with Alexa Google Home, Siri and Echo(No Hub Required), TIKLOK RGBCW Multi-Color, Warm to Cool White Dimmable 7.5W E26 A19 Color Changing Bulb(4 Pack)","https://www.amazon.com/Compatible-Required-Multi-Color-Dimmable-Changing/dp/B07R9ZBQZK/ref=sr_1_107?keywords=smart+light&qid=1581540844&sr=8-107","In Stock.","35."
"MagicLight Smart WiFi Light Bulb, No Hub Required, Dimmable Multicolor A19 E26 7W (60w Equivalent) Smart Bulb, Compatible with Alexa Google Home Siri IFTTT (3 Pack)","https://www.amazon.com/MagicLight-Required-Multicolor-Equivalent-Compatible/dp/B07VLBCGP2/ref=sr_1_108?keywords=smart+light&qid=1581540844&sr=8-108","In Stock.","24."
"NiteBird Smart LED Strip Lights Works with Alexa Google Home, 16.4ft 5050 RGB WiFi Dimmable Flexible Strip Tape Light, Sync to Music, Waterproof, No Hub Required for Room Kitchen Home Bar TV Party","https://www.amazon.com/NiteBird-Dimmable-Flexible-Waterproof-Required/dp/B081F46JSY/ref=sr_1_109?keywords=smart+light&qid=1581540844&sr=8-109","In Stock.","25."
"1080P Smart Bulb Security Camera, 360 Degree Panoramic 2.4G WiFi Camera Indoor/Outdoor Wireless Video Surveillance IP Camera for Baby/Pet Monitor with Night Vision, Two Way Audio, Montion Detection","https://www.amazon.com/Security-Panoramic-Wireless-Surveillance-Detection/dp/B0831KQ6WJ/ref=sr_1_110?keywords=smart+light&qid=1581540844&sr=8-110","Available from these sellers.",""
"Smart WiFi Alexa Light Bulb, Dimmable Multicolor E26 A19 7W (60w Equivalent) Magic Hue LED Light Bulb, Compatible with Alexa Google Home Siri IFTTT (4 Pack)","https://www.amazon.com/Multicolor-Equivalent-Magic-Hue-Compatible/dp/B07VKJXDG9/ref=sr_1_111?keywords=smart+light&qid=1581540844&sr=8-111","In Stock.","32."
"Novostella 2 Pack 20W Smart LED Flood Lights, RGBCW, 2700K-6500K, 2000LM, WiFi Outdoor Dimmable Color Changing Stage Light, IP66 Waterproof, Multicolor Wall Washer Light, Work with Alexa","https://www.amazon.com/Novostella-2700K-6500K-Dimmable-Waterproof-Multicolor/dp/B07VH1VHYL/ref=sr_1_112?keywords=smart+light&qid=1581540844&sr=8-112","In Stock.","89."
"GE Enbrighten Z-Wave Plus Smart Light Dimmer with QuickFit and SimpleWire, Works with Alexa, Google Assistant, SmartThings, Wink, Zwave Hub Required, Repeater/Range Extender, 3-Way Compatible, 46203","https://www.amazon.com/GE-Enbrighten-SimpleWire-SmartThings-46203/dp/B07RRD92T8/ref=sr_1_113?keywords=smart+light&qid=1581540844&sr=8-113","In Stock.","44."
"MagicLight WiFi Bulb No Hub Required, Dimmable Multicolor E26 A19 7W (60w Equivalent) Color Changing LED Smart Light, Compatible with Alexa Google Home Siri IFTTT (4 Pack)","https://www.amazon.com/MagicLight-Required-Multicolor-Equivalent-Compatible/dp/B07VQLZBNW/ref=sr_1_114?keywords=smart+light&qid=1581540844&smid=AEK05O6KNHXR9&sr=8-114","In Stock.","32."
"Treatlife Smart Dimmer Switch, Neutral Wire Needed, 2.4Ghz Wi-Fi Light Switch, Compatible with Alexa and Google Assistant, Schedule, Remote Control, Single Pole (4 PACK)","https://www.amazon.com/Treatlife-Neutral-Compatible-Assistant-Schedule/dp/B07YKFSWJN/ref=sr_1_115?keywords=smart+light&qid=1581540844&sr=8-115","In Stock.","84."
"WiFi Smart LED Light Bulb, A19 E26 RGB+W(6500K) Color Changing Light Bulbs Compatible with Alexa, Google Home Assistant and IFTTT, No Hub Required 7.5W (60W Equivalent)-2 Pack","https://www.amazon.com/Changing-Compatible-Assistant-Required-Equivalent/dp/B083CYZNYJ/ref=sr_1_116?keywords=smart+light&qid=1581540844&sr=8-116","In Stock.","19."
"Novostella 13W 1300LM Smart LED Light Bulbs, WiFi RGBCW 2700K-6500K Dimmable Multicolor Bulb, A19 E26, 120W Equivalent Color Changing Bulb, No Hub Required, Compatible with Alexa, 3 Pack","https://www.amazon.com/Novostella-2700K-6500K-Multicolor-Equivalent-Compatible/dp/B07VLFFX9D/ref=sr_1_117?keywords=smart+light&qid=1581540844&sr=8-117","In Stock.","69."
"LED Night Light Plug in, Super Smart Dusk to Dawn Sensor, Automatic Night Lights Suitable for Bedroom, Bathroom, Toilet,Stairs,Kitchen,Hallway,Kids,Adults,Compact Nightlight, (Warm White, 4 Pack)","https://www.amazon.com/Automatic-Suitable-Bedroom-Bathroom-Nightlight/dp/B083Q333Z7/ref=sr_1_118?keywords=smart+light&qid=1581540844&sr=8-118","In Stock.","13."
"LED WiFi Smart Light Bulb, E26 WiFi Light Bulb Compatible with Alexa Google Home and IFTTT, RGBCW Color Changing, Cool White and Warm White Dimmable, No Hub Required, A19 60W Equivalent (2 Pack)","https://www.amazon.com/LEGELITE-Dimmable-Changing-Required-Equivalent/dp/B07GR4SN63/ref=sr_1_119?keywords=smart+light&qid=1581540844&sr=8-119","In Stock.","22."
"Sinvitron Led Wifi Smart Light Bulb E26 9W, Work with Amazon Alexa, Echo, Google Home and IFTTT, No Hub Required, 900lm, A19 85W Equivalent, RGBCW Multi-color Changing - 2 Pack","https://www.amazon.com/Sinvitron-Required-Equivalent-Multi-color-Changing/dp/B07RSRX1YR/ref=sr_1_120?keywords=smart+light&qid=1581540844&sr=8-120","In Stock.","24."
"E12 Smart Light Bulbs, LOHAS LED WiFi Light Bulbs, 9W Equivalent 60W, Dimmable Daylight 5000K A19 LED Bulbs Candelabra Base, Compatible with Alexa, Google Home Assistant, No Hub Required, 750LM, 4Pack","https://www.amazon.com/LOHAS-LED-Equivalent-Candelabra-Compatible/dp/B07WSBJQN9/ref=sr_1_121?keywords=smart+light&qid=1581540844&sr=8-121","In Stock.","36."
"Smart WiFi LED Light Bulb Dimmable 9W 1000Lm, SLITINTO E26 Multicolor Light Bulb Compatible with Alexa, Echo, Google Home and IFTTT(No Hub Required), A19 90W Equivalent RGB Color Changing Bulb-2 Pack","https://www.amazon.com/Dimmable-SLITINTO-Multicolor-Compatible-Equivalent/dp/B07SPZ8MBD/ref=sr_1_122?keywords=smart+light&qid=1581540844&sr=8-122","In Stock.","24."
"DragonPad 10Pcs LED Smart Touch Induction Cabinet Light Cupboard Inner Hinge Lamp Sensor Light Night Light for Closet Wardrobe White Light 10pcs with Battery","https://www.amazon.com/DragonPad-Induction-Cabinet-Cupboard-Wardrobe/dp/B084KRYB4F/ref=sr_1_123?keywords=smart+light&qid=1581540844&sr=8-123","In stock.","9."
"Philips Hue Play White & Color Smart Light, 2 Pack Base kit, Hub Required/Power Supply Included (Works with Amazon Alexa, Apple Homekit & Google Home)","https://www.amazon.com/Philips-White-Color-Ambiance-Double/dp/B07GXB3S7Z/ref=sr_1_124?keywords=smart+light&qid=1581540844&sr=8-124","In Stock.","129."
"Alexa Light Switch, Double Smart Wifi Light Switches, Smart Switch 2 Gang Works with Google Assistant and IFTTT(Two separate switches with one wall plate)","https://www.amazon.com/Switch-Double-Switches-Google-Assistant/dp/B07L755WM6/ref=sr_1_125?keywords=smart+light&qid=1581540844&sr=8-125","In Stock.","39."
"Barrina Smart Light Bulb Works with Alexa, Siri, Echo, Google Home and IFTTT (No Hub Required), 9W 2.4G E26, Dimmable, WiFi Multicolor Light Bulb, 2800K to 6500K, RGB, Smart LED Bulb (6 Pack)","https://www.amazon.com/Barrina-Changing-Compatible-Assistant-Required/dp/B07SPJJ2CM/ref=sr_1_126?keywords=smart+light&qid=1581540844&sr=8-126","In Stock.","49."
"AMBOTHER LED Strip Lights 32.8-feet Wireless Smart Phone APP Remote Controller 300 LEDs Color Changing Kit Work with Alexa Google Assistant Music Sync Neon RGB Rope Lights","https://www.amazon.com/AMBOTHER-32-8-feet-Wireless-Controller-Assistant/dp/B07VZM3BJZ/ref=sr_1_127?keywords=smart+light&qid=1581540844&sr=8-127","In Stock.","36."
"LoraTap Smart WiFi Bulb Socket E26 2 Pack Wi-Fi LED Light Bulb Lamp Timer Holder Adapter, Voice Control with Amazon Alexa and Google Home Assistant, App Control from Anywhere by Phone, 30W Max.","https://www.amazon.com/LoraTap-Adapter-Control-Assistant-Anywhere/dp/B07PMJ6RM6/ref=sr_1_128?keywords=smart+light&qid=1581540844&sr=8-128","In Stock.","29."
"Smart WiFi Light Bulbs - A19 E26 Dimmable LED Lights by Jeeo - Soft White 60W Equivalent, Compatible with Alexa/Google/IFTTT,2.4GHz Only (4 Pack)","https://www.amazon.com/Smart-WiFi-Light-Bulbs-Equivalent/dp/B081GHBXDF/ref=sr_1_129?keywords=smart+light&qid=1581540844&sr=8-129","","29."
"Harmonic Smart Light Bulb WiFi Multicolor LED Light Bulb Compatible with Alexa, Google Home Assistant, A19 E26 RGB Color Changing Bulb, 8W (60w Equivalent), No Hub Required (2 Pack)","https://www.amazon.com/Harmonic-Multicolor-Compatible-Assistant-Equivalent/dp/B07XK7FWHW/ref=sr_1_130?keywords=smart+light&qid=1581540844&sr=8-130","In Stock.","22."
"Feit Electric BR30/RGBW/CA/AG WiFi Changing and Dimmable, No Hub Required, Alexa or Google Assistant BR30 Smart LED Light Bulb, 65W, Multi-Color RGBW","https://www.amazon.com/Electric-BR30-RGBW-CA-AG/dp/B07GFV1Y9C/ref=sr_1_131?keywords=smart+light&qid=1581540844&sr=8-131","In Stock.","17."
"LIFX A19 Mini Wi-Fi Smart Led Light Bulb (Latest Generation), Dimmable, Warm White, No Hub Required, Works with Amazon Alexa, Apple HomeKit, Google Assistant and Microsoft Cortana","https://www.amazon.com/LIFX-L3A19MW06E26-Mini-White-Light/dp/B07FKJ4LDX/ref=sr_1_132?keywords=smart+light&qid=1581540844&sr=8-132","In Stock.","19."
"Gosund Smart Switch, Smart Light Switch Works with Alexa, Google home and IFTTT, with Remote Control and Schedule, Needs Neutral Wire, Single-Pole, No Hub required, ETL and FCC listed (2 Pack)","https://www.amazon.com/Gosund-Control-required-installation-listed/dp/B07DQG4K52/ref=sr_1_133?keywords=smart+light&qid=1581540844&sr=8-133","In Stock.","29."
"TP-LINK HS200P3 Kasa Smart WiFi Switch (3-Pack) Control Lighting from Anywhere, Easy In-Wall Installation (Single-Pole Only), No Hub Required, Works With Alexa and Google Assistant, White","https://www.amazon.com/TP-LINK-HS200P3-Installation-Single-Pole-Assistant/dp/B07HGW8N7R/ref=sr_1_134?keywords=smart+light&qid=1581540844&sr=8-134","In Stock.","68."
"Smart LED Light Bulbs, LampUX WiFi Bulbs, Works with Alexa and Google Home, Color Changing Light Bulbs, Dimmable with App, A19 E26, 60 Watt Equivalent, No Hub Required (Pack of 2)","https://www.amazon.com/LampUX-Changing-Dimmable-Equivalent-Required/dp/B07PY5ZFM7/ref=sr_1_135?keywords=smart+light&qid=1581540844&sr=8-135","In Stock.","20."
"LED Strip Lights 32.8ft, Smart APP Control 5050 RGB Color Changing LED Light Strip Kit Music Sync, 16 Million Colors Tape Lights with Remote for Bedroom, Room, Party and Home Decoration","https://www.amazon.com/Control-Changing-Million-Bedroom-Decoration/dp/B0819N1MTZ/ref=sr_1_136?keywords=smart+light&qid=1581540844&sr=8-136","In Stock.","35."
"LED Strip Lights Smart WiFi 32.8ft Waterproof RGB 5050LEDs Color Changing Light Strips Work with Alexa, Google Assistant, App and Remote Controlled, 12V Tape Light for Bedroom, Home Decorations","https://www.amazon.com/Waterproof-5050LEDs-Assistant-Controlled-Decorations/dp/B0817FPD2N/ref=sr_1_137?keywords=smart+light&qid=1581540844&sr=8-137","In Stock.","39."
"The Alchemist, 25th Anniversary: A Fable About Following Your Dream","https://www.amazon.com/Alchemist-Paulo-Coelho/dp/0062315005/ref=sr_1_138?keywords=smart+light&qid=1581540844&sr=8-138","In Stock.","10."
"IESTARING Dimmable LED Flush Mount Ceiling Light - 12W (120W Equivalent) WiFi Smart 10"" Round Surface Mount Light Fixture for Bathroom/Bedroom/Dining Room, Compatible with Amazon Alexa (10"" 12W)","https://www.amazon.com/IESTARING-Dimmable-Flush-Mount-Ceiling/dp/B081J6KDZ9/ref=sr_1_139?keywords=smart+light&qid=1581540844&sr=8-139","","39."
"LOHAS Smart LED Light Bulb, A19 Daylight 5000K Dimmable LED Bulb, 50W Equivalent 8W WiFi Light Bulb E26 Base, 720LM APP Control, No Hub Required, Compatible with Amazon Alexa, Google Home, 4 Pack","https://www.amazon.com/LOHAS-LED-Daylight-Equivalent-Compatible/dp/B07Z5Y9X9L/ref=sr_1_140?keywords=smart+light&qid=1581540844&sr=8-140","In Stock.","31."
"OHLUX BR30 Smart Light Bulb Works with Alexa & Google (No Hub Required), Color Changing Wi-Fi R30 Flood LED Lamp Bulb, 10W(100W Equivalent), E26, 2700K-6500K Dimmable, IFTTT Siri Compatible, 4-Pack","https://www.amazon.com/OHLUX-Required-Equivalent-2700K-6500K-Compatible/dp/B0838SW8V2/ref=sr_1_141?keywords=smart+light&qid=1581540844&sr=8-141","In Stock.","54."
"Geeni GN-BW912-999 LUX Smart Floodlight, White – Outdoor 2700K-6500K Dimmable LED Bulb, E26, PAR38, 11W, 1000 Lumens – No Hub Works with Amazon Alexa, Google Assistant, Requires 2.4 GHz Wi-Fi","https://www.amazon.com/Geeni-GN-BW912-999-Smart-Floodlight-White/dp/B07XPLCZ1K/ref=sr_1_142?keywords=smart+light&qid=1581540844&sr=8-142","","24."
"Sunco Lighting 4 Pack WiFi LED Smart Bulb, B11 Candelabra, 4.5W, E12 Base, Color Changing (RGB & CCT), Dimmable, Compatible with Amazon Alexa & Google Assistant - No Hub Required","https://www.amazon.com/Sunco-Lighting-Candelabra-Compatible-Assistant/dp/B07NVY25SX/ref=sr_1_143?keywords=smart+light&qid=1581540844&sr=8-143","In Stock.","39."
"Aigital WiFi Smart Light Bulb,RGB LED Color Changing Dimmable Smartphone App Controlled Daylight & Night Light,Color Bulbs Compatible with Alexa and Google Assistant,10W Home Lighting,No Hub Required","https://www.amazon.com/Aigital-Smartphone-Controlled-Compatible-Assistant/dp/B07PVDQJ9S/ref=sr_1_144?keywords=smart+light&qid=1581540844&sr=8-144","In Stock.","16."
"Smart Light Bulbs with White Light 2700k-6000k - 6W LED Candalabra Bulb E12 Base - 60W Equivalent - WiFi Multicolor Light Bulb - B11 RGB Color Changing Bulb, Works with Google Assistant IFTTT, 3 Pack","https://www.amazon.com/Smart-Light-Bulbs-White-2700k-6000k/dp/B07YC9TG4L/ref=sr_1_145?keywords=smart+light&qid=1581541432&sr=8-145","In Stock.","37."
"Vaticas 1 100-240V Smart WiFi Light Switch,Compatible with Alexa,Google Home and IFTTT, with Remote Control and Timer,No Hub Required Applicable to Family and Office(3 Gang White)","https://www.amazon.com/Smart-Light-Switch-Vaticas-Compatible/dp/B07Q7PWJ77/ref=sr_1_146?keywords=smart+light&qid=1581541432&sr=8-146","In Stock.","55."
"Smart Light Bulb with Soft White Light 2800k-6200k + RGBW, TECKIN A19 WiFi Multicolor LED Bulb Compatible with Phone, Google Home, 8w (60w Equivalent),4 Pack","https://www.amazon.com/2800k-6200k-TECKIN-Multicolor-Compatible-Equivalent/dp/B07VPGNGF2/ref=sr_1_147?keywords=smart+light&qid=1581541432&sr=8-147","In Stock.","39."
"3 Way Smart Light Switch (Only One Needed), Meross WiFi Light Switch Compatible with Alexa, Google Assistant and IFTTT, LED Smart Switch with Voice Control, Schedule, Remote Control, ETL/FCC Listed","https://www.amazon.com/Switch-Compatible-Assistant-Control-Schedule/dp/B07WSZTYCR/ref=sr_1_148?keywords=smart+light&qid=1581541432&sr=8-148","In Stock.","26."
"MOES WiFi Smart Light Switch,2 Gang No Screw Panel Smart Life/Tuya App Wireless Remote Control Wall Switch Timer for Lights,Compatible with Alexa,Google Home,No Hub required","https://www.amazon.com/MOES-Wireless-Control-Compatible-required/dp/B07WHWR8CV/ref=sr_1_149?keywords=smart+light&qid=1581541432&sr=8-149","In Stock.","39."
"Aoycocr Smart Light Switch 2-Pack - Neutral Wire Needed, Single Pole, 2.4Ghz Wi-Fi Light Switch 110-240V, Easy to Install, Compatible with Alexa, Google Assistant, Schedule, Remote Control, FCC Listed","https://www.amazon.com/Aoycocr-Smart-Light-Switch-2-Pack/dp/B07Y8CQ6BG/ref=sr_1_150?keywords=smart+light&qid=1581541432&sr=8-150","In Stock.","28."
