"product_name","product_url","product_instock","product_price"
"Sengled Smartsense Flood Light with Motion Sensor & Daylight Sensor, Smart LED Light Bulb PAR38, Dusk to Dawn Bulb, Waterproof 5000K for Indoor and Outdoor Use (3rd Gen), 2 Pack","https://www.amazon.com/Sengled-Smartsense-Daylight-Waterproof-Outdoor/dp/B07QH59F1H/ref=sr_1_151?keywords=smart+light&qid=1581541432&sr=8-151","In Stock.","43."
"Smart Dimmer Switch, Gosund Smart WiFi Light Switch Compatible with Alexa & Google Home, with Remote Control & Schedule, Neutral Wire Needed, Single-Pole, No Hub Required, Easy Installation (2 Pack)","https://www.amazon.com/Gosund-Compatible-Schedule-Single-Pole-Installation/dp/B07X1QRC23/ref=sr_1_152?keywords=smart+light&qid=1581541432&sr=8-152","In Stock.","39."
"Smart LED Strip Lights Works with Alexa, Govee APP Control Waterproof 16.4ft RGB LED Light Strip WiFi Sync with Music, 16 Million Colors 5050 LED Lights for Home, Kitchen, TV, Party","https://www.amazon.com/Waterproof-Wireless-Controlled-Assistance-Control/dp/B07HRHDV1T/ref=sr_1_153?keywords=smart+light&qid=1581541432&sr=8-153","In Stock.","28."
"AISIRER Smart Light Bulb WiFi LED Light Bulbs 9W 806LM Compatible with Amazon Alexa Echo Dot Google Home Assistant and IFTTT E26 Dimmable Warm Light 2700K No Hub Required A19 (4 Pack)","https://www.amazon.com/Compatible-Assistant-Equivalent-Dimmable-AISIRER/dp/B07RHMQ2DD/ref=sr_1_154?keywords=smart+light&qid=1581541432&sr=8-154","In Stock.","41."
"Smart WiFi Fan Switch Ceiling Fan and Light Remote Control Kit, WiFi Fan Controller Compatible with Alexa Google, Phone APP Control, No Hub Required, Universal Ceiling Fan Light Remote Control","https://www.amazon.com/Ceiling-Controller-Compatible-Required-Universal/dp/B07Z948VY4/ref=sr_1_155?keywords=smart+light&qid=1581541432&sr=8-155","In Stock.","27."
"Sunco Lighting 2 Pack WiFi LED Smart Bulb, G25, 5W, Color Changing (RGB & CCT), Dimmable, Compatible with Amazon Alexa & Google Assistant - No Hub Required","https://www.amazon.com/Sunco-Lighting-Changing-Compatible-Assistant/dp/B07NVY18WF/ref=sr_1_156?keywords=smart+light&qid=1581541432&sr=8-156","In Stock.","24."
"Alexa Certified LED Edison Smart Light Bulb 2 Pack of Alexa Light Bulbs Vintage E26 Base Antique Color Adjustable 2200K to 3000K Dimmable WiFi No Hub Required","https://www.amazon.com/Pack-Smart-LED-Edison-Bulbs/dp/B07P8WZ521/ref=sr_1_157?keywords=smart+light&qid=1581541432&sr=8-157","","24."
"Smart Light Bulb, Daylight Multicolor Led Bulbs A19 E26 750 lm Work with Alexa, Echo, Google Home and IFTTT(No Hub Required) RGB Color Changing Dimmable, UL Listed, 4 Pack","https://www.amazon.com/Daylight-Multicolor-Required-Changing-Dimmable/dp/B07W4C33BT/ref=sr_1_158?keywords=smart+light&qid=1581541432&sr=8-158","In Stock.","41."
"DORESshop Wi-Fi Smart LED Light Bulb, E26 Dimmable 10W(75W Equivalent) Vintage Edison WiFi LED Edison Bulb, ST64 Antique LED Filament Light Bulb, Work with Alexa and Google Assistant, 2 Pack","https://www.amazon.com/DORESshop-Dimmable-Equivalent-Filament-Assistant/dp/B07SG6B1J5/ref=sr_1_159?keywords=smart+light&qid=1581541432&sr=8-159","In Stock.","27."
"GE Lighting 93105377 C by GE LED A19 Full Color, Works with Alexa and Google Assistant, WiFi Enabled, 2-Pack Smart Light Bulb","https://www.amazon.com/GE-Lighting-93105377-Full-Color/dp/B07NWD6C7K/ref=sr_1_160?keywords=smart+light&qid=1581541432&sr=8-160","In Stock.","54."
"The Spy Who Dumped Me","https://www.amazon.com/Spy-Who-Dumped-Me/dp/B07G4GKBDD/ref=sr_1_161?keywords=smart+light&qid=1581541432&sr=8-161","","7."
"Aigital Smart WiFi Light Bulb, LED WiFi Color Changing Dimmable Bulb Cool&Warm Multicolor Bulbs Work with Alexa, 9W No Hub Required(Remote&Voice Control, Memory Function, DIY Scene Mode)-2 Pack","https://www.amazon.com/Aigital-Changing-Dimmable-Multicolor-Required/dp/B07ZCSRSCQ/ref=sr_1_162?keywords=smart+light&qid=1581541432&sr=8-162","In Stock.","24."
"Smart Light Bulb, LOHAS BR20 LED WiFi Bulb 60 Watt Equivalent, 2700K-6000K Daylight RGB Coloring Changing Lights, Dimmable LED E26 Bulbs Work with Alexa, Google Assistant, Siri, No Hub Required, 4Pack","https://www.amazon.com/LOHAS-LED-Equivalent-2700K-6000K-Assistant/dp/B07ZTC7MT6/ref=sr_1_163?keywords=smart+light&qid=1581541432&sr=8-163","In Stock.","43."
"Outdoor Dimmer, Homder Smart Plug for String Lights,Smart APP WiFi Dimmer Switch Compatible with Alexa Google Home-350W Max Power/IP44 Waterproof/Stepless Dimming for Dimmable LED String Lights","https://www.amazon.com/Homder-Compatible-Home-350W-Waterproof-Stepless/dp/B07XZCZW9P/ref=sr_1_164?keywords=smart+light&qid=1581541432&sr=8-164","In Stock.","35."
"LED Strip Lights, 32.8ft RGB Color Changing Rope Lights 300 LEDs SMD5050 Light Strips Voice and Music Sync Smart LED Lights for Home, TV and Party Decoration-Remote Control + Bluetooth APP Controlled","https://www.amazon.com/Changing-SMD5050-Decoration-Remote-Bluetooth-Controlled/dp/B081MWWR8J/ref=sr_1_165?keywords=smart+light&qid=1581541432&sr=8-165","In Stock.","31."
"Bluetooth Music Strip Lights 33Feet, Hedynshine Strip Lights Sync to Music SMD 5050 300pcs LED Chips, RGB 12V Rope Lights, Smart Phone App Controled color changing light strips","https://www.amazon.com/HEDYNSHINE-Adjustable-Spotlight-Wireless-Waterproof/dp/B07QC2F4MK/ref=sr_1_166?keywords=smart+light&qid=1581541432&sr=8-166","In Stock.","37."
"Onforu 3 Pack Smart Light Bulb, RGBW LED WiFi Light Bulbs, Work with Alexa and Google Home Assistant, No Hub Required, A19 E26 Multicolor Bulb","https://www.amazon.com/Onforu-Google-Assistant-Required-Multicolor/dp/B07W45JHND/ref=sr_1_167?keywords=smart+light&qid=1581541432&sr=8-167","In Stock.","29."
"Sengled Smart LED Daylight Extra Bright A19 Light Bulb, Hub Required, 5000K 100W Equivalent, Works with Alexa, Google Assistant & SmartThings, 1 Pack","https://www.amazon.com/Sengled-Daylight-Equivalent-Assistant-SmartThings/dp/B07QDVC69G/ref=sr_1_168?keywords=smart+light&qid=1581541432&sr=8-168","In Stock.","24."
"Leviton DW15S-1BZ Decora Smart Wi-Fi 15A Universal LED/Incandescent Switch, Works with Amazon Alexa, No Hub Required","https://www.amazon.com/Leviton-DW15S-1BZ-Universal-Incandescent-Required/dp/B01MU9SH77/ref=sr_1_169?keywords=smart+light&qid=1581541432&sr=8-169","In Stock.","39."
"Smart Dimmer Switch,Neutral Wire Required,Treatlife WiFi Light Switch for Dimmable LED, Halogen and Incandescent Bulbs, Compatible with Alexa, Google Assistant, Remote Control, Single-Pole(4 Pack)","https://www.amazon.com/Treatlife-Incandescent-Compatible-Assistant-Single-Pole/dp/B07PJTLB7Z/ref=sr_1_170?keywords=smart+light&qid=1581541432&sr=8-170","In Stock.","86."
"BRTLX Smart Light Bulb, RGB Dimmable Wi-Fi LED Bulb, 9W 800LM,Free APP and Voice Control, Compatible with Amazon Alexa and Google Assistant,No Hub Required,A60 E26 Multicolored Smart Bulbs (4 Pack)","https://www.amazon.com/BRTLX-Dimmable-Compatible-Assistant-Multicolored/dp/B07JFVQ6B7/ref=sr_1_171?keywords=smart+light&qid=1581541432&sr=8-171","In Stock.","35."
"Philips Hue White Outdoor PAR38 13W Smart Bulbs (Philips Hue Hub required), 2 White PAR38 LED Smart Bulbs, Works with Alexa, Apple HomeKit and Google Assistant","https://www.amazon.com/Philips-Outdoor-Hue-PAR-38-476820/dp/B07D9XL641/ref=sr_1_172?keywords=smart+light&qid=1581541432&sr=8-172","In Stock.","49."
"Sengled Smart LED Light Bulb (Hub Required), Smart Light Bulb Soft White 2700K 65W Equivalent BR30 Dimmable, Compatible with Alexa/Echo Plus/SmartThings/Google Assistant/IFTTT, 6 Pack","https://www.amazon.com/Sengled-Equivalent-Compatible-SmartThings-Assistant/dp/B07XJTXCKF/ref=sr_1_173?keywords=smart+light&qid=1581541432&sr=8-173","In Stock.","69."
"Philips Hue Econic Smart Outdoor White & Color Wall Lantern, Down (Hue Hub Required, Smart Light Works with Alexa, Apple Homekit & Google Assistant)","https://www.amazon.com/Philips-Hue-1744030V7-Ambiance-Lantern/dp/B07NDHCV36/ref=sr_1_174?keywords=smart+light&qid=1581541432&sr=8-174","In Stock.",""
"SYLVANIA SMART+ ZigBee Full Color Accent Light Starter Kit, Works with SmartThings and Amazon Echo Plus","https://www.amazon.com/SYLVANIA-ZigBee-Accent-Starter-SmartThings/dp/B07FK5FC64/ref=sr_1_175?keywords=smart+light&qid=1581541432&sr=8-175","In Stock.","21."
"LE LampUX GU10 WiFi Smart Light Bulbs Compatible with Alexa Google Home, Tunable White Warm to Daylight, App Control Dimmable GU10 LED Track Light Bulb 50W Halogen Equiv, No Hub Required, 2 Pack","https://www.amazon.com/Compatible-Tunable-Daylight-Dimmable-Required/dp/B07P5Y4BFL/ref=sr_1_176?keywords=smart+light&qid=1581541432&sr=8-176","In Stock.","21."
"JOMARTO Smart WiFi LED Light Bulb, 2 Pack Compatible with Alexa/Google Home, 60W Equivalent Color Changing Multicolor Dimmable Light Bulb 900LM Remote Control No Hub Required (Two Pack)","https://www.amazon.com/JOMARTO-Compatible-Equivalent-Changing-Multicolor/dp/B07RYMJPMV/ref=sr_1_177?keywords=smart+light&qid=1581541432&sr=8-177","In Stock.","18."
"Smart Candelabra Bulbs E12 Base, LED Light Bulb Ceiling Fan Dimmable and Color Changing, 5W Tunable White 2700K-6500K, Compatible with Alexa Google Home","https://www.amazon.com/Candelabra-Dimmable-Changing-2700K-6500K-Compatible/dp/B082FDFRKL/ref=sr_1_178?keywords=smart+light&qid=1581541432&sr=8-178","In Stock.","30."
"Smart LED Light Bulb RGB Color Changing Light Bulb - Daylight 6500K - 750 Lumens - E26 Base - Dimmable - Works with Alexa Google Home IFTTT - No Hub Required - UL ETL Listed","https://www.amazon.com/Aoycocr-Dimmable-Compatible-Required-Equivalent/dp/B07NW21RM1/ref=sr_1_179?keywords=smart+light&qid=1581541432&sr=8-179","In Stock.","14."
"DreamColor LED Strip Lights, Govee 16.4ft WiFi Wireless Smart Light Strip Works with Alexa Google Assistant App Control for Room Bedroom Kitchen Outdoors Music Sync Waterproof (Not Support 5G WiFi)","https://www.amazon.com/DreamColor-MINGER-Wireless-Controlled-Assistance/dp/B07HRHLKGK/ref=sr_1_180?keywords=smart+light&qid=1581541432&sr=8-180","In Stock.","33."
"Smart Light Bulb Works with Alexa Google Home, NiteBird A19 E26 WiFi Multicolor Dimmable LED Lights Bulbs, 2700k + RGB, 75W Equivalent, No Hub Required, 2 Pack","https://www.amazon.com/TanTan-Smart-Bulb/dp/B07MTZNJP5/ref=sr_1_181?keywords=smart+light&qid=1581541432&sr=8-181","In Stock.","20."
"Sunco Lighting 6 Pack WiFi LED Smart Bulb, A19, 6W, Color Changing (RGB & CCT), Dimmable, 480 LM, Compatible with Amazon Alexa & Google Assistant - No Hub Required","https://www.amazon.com/Sunco-Lighting-Changing-Compatible-Assistant/dp/B07L51DWSF/ref=sr_1_182?keywords=smart+light&qid=1581541432&sr=8-182","In Stock.","59."
"meross Smart WiFi Light Switch, Wall Switch, Compatible with Amazon Alexa, Google Assistant and IFTTT, Remote Control, Schedules, Timer, No Hub Needed - Upgrade Version 2 Pack","https://www.amazon.com/meross-Compatible-Assistant-Control-Schedules/dp/B07KXNHNCB/ref=sr_1_183?keywords=smart+light&qid=1581541432&sr=8-183","In Stock.","29."
"Smart Light Switch TECKIN Single-pole Wi-Fi In-wall Switch, Work With Alexa, Google home and Google Nest Hub, Control Lighting Anywhere Anytime, Easy In-Wall Installation, No Hub Required(1 PC)","https://www.amazon.com/Single-Pole-TECKIN-Schedule-Installation-Required/dp/B07RBK2V32/ref=sr_1_184?keywords=smart+light&qid=1581541432&sr=8-184","In Stock.","17."
"Novostella Smart Light Bulb, WiFi RGBCW LED Color Changing Bulb, 7W 600LM Dimmable Multicolored Lights, No Hub Required, Compatible with Alexa Google Assistant IFTTT (60W Equivalent, A19 E26, 3 Pack)","https://www.amazon.com/Novostella-Multicolored-Compatible-Assistant-Equivalent/dp/B07Y1G9WKG/ref=sr_1_185?keywords=smart+light&qid=1581541432&sr=8-185","In Stock.","29."
"MustWin Smart Retrofit Led Recessed Lighting 6 inch LED Downlight, Bluetooth Mesh LED Can Lights Color Changing, Voice Control via Alexa, Dimmable RGBCW 15W4 Pack(Hub Included)","https://www.amazon.com/MustWin-Retrofit-Recessed-Downlight-Bluetooth/dp/B07WFXKJJM/ref=sr_1_186?keywords=smart+light&qid=1581541432&sr=8-186","In Stock.","119."
"Smart Light Bulb Wi-Fi Color LED Light Work with Alexa & Google Home, Dimmable Multicolored 60W Equivalent RGBW Color Mode, No Hub Required, A19 E26 / E27 Base Type, 7W, 2PCS","https://www.amazon.com/Google-Dimmable-Multicolored-Equivalent-Required/dp/B07RQL52WY/ref=sr_1_187?keywords=smart+light&qid=1581541432&sr=8-187","In Stock.","19."
"Sengled Smart Light Bulb, Daylight Extra Bright A19 Smart Light Bulb, Smart Hub Required, 5000K 100W Equivalent, Smart Bulb That Compatible with Alexa, Google Assistant & SmartThings, 1 Pack","https://www.amazon.com/Sengled-Equivalent-Compatible-Assistant-SmartThings/dp/B083JT3QRG/ref=sr_1_188?keywords=smart+light&qid=1581541432&sr=8-188","In Stock.","22."
"Smart Light Bulb Dimmable Soft White 2700K RGBW - Aoycocr A19 E26 Color Changing Lights Bulb Work with Alexa Google Home IFTTT for Smart Home, No Hub Required, 750 Lumens, 7.5 (65W Equivalent), 4 Pack","https://www.amazon.com/Smart-Light-Dimmable-White-2700K/dp/B07T5JZZRT/ref=sr_1_189?keywords=smart+light&qid=1581541432&sr=8-189","In Stock.","40."
"Smart LED Strip Lights Works with Alexa, Govee APP Control 16.4ft WiFi Light Strip, Music Sync 16 Million Colors RGB LED Lights for Room, Home, Kitchen, TV, Party, Halloween, Christmas, Waterproof","https://www.amazon.com/Govee-Control-Halloween-Christmas-Waterproof/dp/B07TTCSP86/ref=sr_1_190?keywords=smart+light&qid=1581541432&sr=8-190","In Stock.","28."
"Wixann 9W Smart Wi-Fi Light Bulb Compatible with Alexa & Google Home Assistant (No Hub Required, 2.4Ghz Only), A19, E26, 80W Equivalent Dimmable RGBCW Color Changing LED Bulbs for Siri IFTTT, 3 Pack","https://www.amazon.com/Wixann-Compatible-Assistant-Required-Equivalent/dp/B07Z2VZ5DX/ref=sr_1_191?keywords=smart+light&qid=1581541432&sr=8-191","In Stock.","31."
"Sengled Smart LED Multicolor Light Bulb, Hub Required, RGBW Color & Tunable White 2000-6500K, A19 60W Equivalent, Works with Alexa, Google Assistant & SmartThings, 1 Pack","https://www.amazon.com/Sengled-Multicolor-2000-6500K-Equivalent-SmartThings/dp/B073ZBYXKQ/ref=sr_1_192?keywords=smart+light&qid=1581541432&sr=8-192","In Stock.","24."